{
  "analyzer_version": "2.0.0",
  "analyzed_at": "2026-10-30T07:48:04.001021+00:00",
  "target_path": "target/APEC_mat_kinh_cho_nguoi_khiem_thi",
  "git_info": {
    "commit_hash": "d9ba1e0d42e1241471b1fb58df1efb9d345c6721",
    "short_hash": "d9ba1e0",
    "branch": "main",
    "commit_date": "2026-10-28 12:41:05 +0700",
    "author": "Matthias Kreier",
    "commit_message": "Update README with license and LIDAR sensor details",
    "remote_url": "https://github.com/thanh1912-ut/APEC_mat_kinh_cho_nguoi_khiem_thi.git"
  },
  "total_files": 138,
  "total_dirs": 34,
  "total_lines": 27525,
  "code_lines": 13282,
  "comment_lines": 254,
  "blank_lines": 1765,
  "doc_lines": 627,
  "data_lines": 11597,
  "languages": {
    "Plain Text": {
      "files": 5,
      "lines": 175,
      "code_lines": 99,
      "comment_lines": 0,
      "blank_lines": 7,
      "doc_lines": 69,
      "data_lines": 0,
      "category": "doc"
    },
    "Dockerfile": {
      "files": 1,
      "lines": 30,
      "code_lines": 29,
      "comment_lines": 0,
      "blank_lines": 1,
      "doc_lines": 0,
      "data_lines": 0,
      "category": "config"
    },
    "TOML": {
      "files": 1,
      "lines": 27,
      "code_lines": 25,
      "comment_lines": 0,
      "blank_lines": 2,
      "doc_lines": 0,
      "data_lines": 0,
      "category": "config"
    },
    "Markdown": {
      "files": 15,
      "lines": 841,
      "code_lines": 0,
      "comment_lines": 0,
      "blank_lines": 283,
      "doc_lines": 558,
      "data_lines": 0,
      "category": "doc"
    },
    "Other (.example)": {
      "files": 2,
      "lines": 22,
      "code_lines": 21,
      "comment_lines": 0,
      "blank_lines": 1,
      "doc_lines": 0,
      "data_lines": 0,
      "category": "code"
    },
    "JSON": {
      "files": 7,
      "lines": 11552,
      "code_lines": 0,
      "comment_lines": 0,
      "blank_lines": 0,
      "doc_lines": 0,
      "data_lines": 11552,
      "category": "data"
    },
    "SQL": {
      "files": 1,
      "lines": 44,
      "code_lines": 0,
      "comment_lines": 0,
      "blank_lines": 0,
      "doc_lines": 0,
      "data_lines": 44,
      "category": "data"
    },
    "Python": {
      "files": 39,
      "lines": 6952,
      "code_lines": 5729,
      "comment_lines": 186,
      "blank_lines": 1037,
      "doc_lines": 0,
      "data_lines": 0,
      "category": "code"
    },
    "HTML": {
      "files": 1,
      "lines": 127,
      "code_lines": 122,
      "comment_lines": 0,
      "blank_lines": 5,
      "doc_lines": 0,
      "data_lines": 0,
      "category": "code"
    },
    "CSS": {
      "files": 1,
      "lines": 759,
      "code_lines": 758,
      "comment_lines": 0,
      "blank_lines": 1,
      "doc_lines": 0,
      "data_lines": 0,
      "category": "code"
    },
    "JavaScript": {
      "files": 4,
      "lines": 714,
      "code_lines": 671,
      "comment_lines": 1,
      "blank_lines": 42,
      "doc_lines": 0,
      "data_lines": 0,
      "category": "code"
    },
    "TypeScript (React)": {
      "files": 14,
      "lines": 1890,
      "code_lines": 1747,
      "comment_lines": 7,
      "blank_lines": 136,
      "doc_lines": 0,
      "data_lines": 0,
      "category": "code"
    },
    "TypeScript": {
      "files": 37,
      "lines": 3951,
      "code_lines": 3700,
      "comment_lines": 44,
      "blank_lines": 207,
      "doc_lines": 0,
      "data_lines": 0,
      "category": "code"
    },
    "YAML": {
      "files": 1,
      "lines": 11,
      "code_lines": 11,
      "comment_lines": 0,
      "blank_lines": 0,
      "doc_lines": 0,
      "data_lines": 0,
      "category": "config"
    },
    "Other (.gradle)": {
      "files": 1,
      "lines": 19,
      "code_lines": 16,
      "comment_lines": 0,
      "blank_lines": 3,
      "doc_lines": 0,
      "data_lines": 0,
      "category": "code"
    },
    "Kotlin": {
      "files": 4,
      "lines": 385,
      "code_lines": 333,
      "comment_lines": 12,
      "blank_lines": 40,
      "doc_lines": 0,
      "data_lines": 0,
      "category": "code"
    },
    "XML": {
      "files": 1,
      "lines": 1,
      "code_lines": 0,
      "comment_lines": 0,
      "blank_lines": 0,
      "doc_lines": 0,
      "data_lines": 1,
      "category": "data"
    },
    "Shell Script": {
      "files": 3,
      "lines": 25,
      "code_lines": 21,
      "comment_lines": 4,
      "blank_lines": 0,
      "doc_lines": 0,
      "data_lines": 0,
      "category": "code"
    }
  },
  "key_files": {
    "configs": [
      "requirements.txt",
      "Dockerfile",
      "pyproject.toml",
      ".env.example",
      "mobile/package.json",
      "mobile/tsconfig.json",
      "mobile/.env.example",
      "mobile/modules/mat-kinh-controls/package.json",
      "mobile/modules/mat-kinh-controls/android/build.gradle"
    ],
    "docs": [
      "Dockerfile",
      "README.md",
      "docs/MOBILE_ARCHITECTURE.md",
      "docs/IMPLEMENTATION_STATUS.md",
      "docs/VOICE_CONTEXT_020.md",
      "docs/GUIDANCE_ACCEPTANCE_040.md",
      "docs/ANDROID_SETUP.md",
      "docs/ANDROID15_FIX.md",
      "docs/INPUT_FIX_013.md",
      "docs/UPLOAD_FIX_012.md",
      "docs/RELEASE_040.md",
      "docs/RELEASE_021.md",
      "docs/HARDWARE_CONTROLS_030.md",
      "docs/GUIDANCE_040.md",
      "docs/RELEASE_030.md",
      "docs/ANDROID_ACCEPTANCE.md"
    ],
    "ci_cd": [],
    "tests": [
      "tests/test_evaluate_mobile.py",
      "tests/test_guidance_storage.py",
      "tests/test_mobile_vision.py",
      "tests/test_guidance_mobile_compat.py",
      "tests/test_asr.py",
      "tests/test_session.py",
      "tests/test_download_model.py",
      "tests/test_guidance_admin.py",
      "tests/test_bundle.py",
      "tests/test_guidance.py",
      "tests/test_vision.py",
      "tests/test_mobile_pipeline.py",
      "tests/test_trial_token.py",
      "tests/test_webrtc.py",
      "tests/test_api.py",
      "tests/test_analysis_api.py",
      "tests/test_mobile_api.py",
      "tests/test_guidance_search.py",
      "mobile/tests/controlInput.test.ts",
      "mobile/tests/recordingEvents.test.ts",
      "mobile/tests/deviceTaskController.test.ts",
      "mobile/tests/turnController.test.ts",
      "mobile/tests/hardwareControlsNative.test.ts",
      "mobile/tests/guidanceApi.test.ts",
      "mobile/tests/useTurnController.test.tsx",
      "mobile/tests/deviceRecovery.test.ts",
      "mobile/tests/actionCommands.test.ts",
      "mobile/tests/credentials.test.ts",
      "mobile/tests/conversation.test.ts",
      "mobile/tests/media.test.ts",
      "mobile/tests/api.test.ts",
      "mobile/tests/speech.test.ts",
      "mobile/tests/useHardwareControls.test.tsx",
      "mobile/tests/components/HomeScreen.test.tsx",
      "mobile/tests/components/SettingsScreen.test.tsx",
      "mobile/modules/mat-kinh-controls/android/src/test/java/expo/modules/matkinhcontrols/VolumeKeyPolicyTest.kt"
    ]
  },
  "security_flags": [
    {
      "file": "tests/test_evaluate_mobile.py",
      "type": "Hardcoded Credentials in Assignment",
      "severity": "MEDIUM",
      "category": "secret",
      "match": "secr...e\"",
      "confidence": 0.85,
      "scanner": "heuristic_regex_preliminary"
    },
    {
      "file": "tests/test_mobile_vision.py",
      "type": "Hardcoded Credentials in Assignment",
      "severity": "MEDIUM",
      "category": "secret",
      "match": "api_...y\"",
      "confidence": 0.85,
      "scanner": "heuristic_regex_preliminary"
    },
    {
      "file": "tests/test_guidance.py",
      "type": "Hardcoded Credentials in Assignment",
      "severity": "MEDIUM",
      "category": "secret",
      "match": "api_...y\"",
      "confidence": 0.85,
      "scanner": "heuristic_regex_preliminary"
    },
    {
      "file": "tests/test_guidance.py",
      "type": "Hardcoded Credentials in Assignment",
      "severity": "MEDIUM",
      "category": "secret",
      "match": "api_...y\"",
      "confidence": 0.85,
      "scanner": "heuristic_regex_preliminary"
    },
    {
      "file": "tests/test_vision.py",
      "type": "Hardcoded Credentials in Assignment",
      "severity": "MEDIUM",
      "category": "secret",
      "match": "api_...t\"",
      "confidence": 0.85,
      "scanner": "heuristic_regex_preliminary"
    }
  ],
  "structure": [
    {
      "name": "app",
      "is_dir": true,
      "children": [
        {
          "name": "__init__.py",
          "is_dir": false
        },
        {
          "name": "asr.py",
          "is_dir": false
        },
        {
          "name": "bundle.py",
          "is_dir": false
        },
        {
          "name": "config.py",
          "is_dir": false
        },
        {
          "name": "guidance.py",
          "is_dir": false
        },
        {
          "name": "guidance_admin.py",
          "is_dir": false
        },
        {
          "name": "guidance_api.py",
          "is_dir": false
        },
        {
          "name": "guidance_contract.py",
          "is_dir": false
        },
        {
          "name": "guidance_search.py",
          "is_dir": false
        },
        {
          "name": "guidance_storage.py",
          "is_dir": false
        },
        {
          "name": "guidance_vision.py",
          "is_dir": false
        },
        {
          "name": "main.py",
          "is_dir": false
        },
        {
          "name": "mobile_api.py",
          "is_dir": false
        },
        {
          "name": "mobile_pipeline.py",
          "is_dir": false
        },
        {
          "name": "mobile_security.py",
          "is_dir": false
        },
        {
          "name": "session.py",
          "is_dir": false
        },
        {
          "name": "vision.py",
          "is_dir": false
        }
      ]
    },
    {
      "name": "docs",
      "is_dir": true,
      "children": [
        {
          "name": "screenshots",
          "is_dir": true,
          "children": [
            {
              "name": "assistant.png",